Fistaszki to inczej orzechy:;laskowe;brazylijskie;włoskie;ziemne
Pies Ali z "Elementarza" Mariana Falskiego to:;Reks;Burek;Azor;As
Do której godziny Kopciuszek właśnie mógł zostać na balu ?;21:00;22:00;23:00;00:00
W jakim państwie opracowano pierwszą encyklopedie ?;Włoszech;Anglii;Hiszpanii;Francji
Jeśli ktoś coś trafnie przewidział to mówimy że to:;wyszczekał;wymruczał;wybeczał;wykrakał
Duże zarobki to tak zwane:;ananasy;przekręty;stosy;kokosy
Redestnica jest rośliną:;leśną;łąkową;tropikalną;wodną
O kim opowiada pieśń Bogurodzica:;św. Elżbiecie;św. Teresie;św. Annie;Maryi
Zestaw różnych barw to:;akwarela;sztaluga;tempera;paleta
Powszechnie używana sól to:;chlorek potasu;dwutlenek sodu;dwutlenek potasu;chlorek sodu